{
  "$schema": "https://opensource.adobe.com/spectrum-design-data/schemas/v0/guideline.schema.json",
  "$id": "https://opensource.adobe.com/spectrum-design-data/guidelines/layout-and-structure-containers.json",
  "name": "layout-and-structure-containers",
  "title": "Containers",
  "category": "designing",
  "documentBlocks": [
    {
      "type": "purpose",
      "content": "In Spectrum 2, containers have more defined rules to help guide in the creation of custom containers for product-specific contexts. Containers are used across Spectrum 2 interfaces in multiple ways, but the commonality they share is that they group related concepts together into distinct areas. Some usages of containers have more detailed guidelines. For example, a card uses a container and inherits its properties, but it can only represent a distinct object (such as an individual asset or product). A block of marketing material containing multiple concepts (like subscription information plus actions to take) is grouped together in a container, but is not considered a card. Whether broad or specific, a user should be able to readily tell the purpose of a container. Separation of containers is marked through a clear visual change, such as contrast in a background color or through spacing. All containers share a common set of rules for styles , padding , and emphasis .\n\n### Example\n\nCards and select boxes share container styles. In this example, both use the emphasized style. Cards also have additional options that select boxes do not, like t-shirt size and layout. Examples of containers: two cards with different sizes and layout options, and a select box."
    },
    {
      "type": "guideline",
      "content": "All containers share a set of defined styles. Background color By default, containers are visually distinguished through a change in background color. Learn more about this in background layers . Emphasized In some situations, drop shadows are used to provide emphasis to a container or group of containers, like in a set of related cards. Emphasized containers should be used sparingly. View more about container emphasis . Border Borders can also be used around objects as an alternate style to a background color, and should be used without a fill. Vertical, full-width dividers can also be used to create separation for larger sections of content, like in a panel. View more about border width . Spacing This is the container style with the least emphasis. Instead of using a visible border, spacing is used to create separation between concepts. View more about spacing ."
    },
    {
      "type": "guideline",
      "content": "Example.\n\nThis medium card uses spacing-300 for internal padding."
    },
    {
      "type": "guideline",
      "content": "Example.\n\nIn this group of containers — each representing a product — different container styles can be used to draw attention to a specific item. In this case, the emphasized container is paired with a badge, and contrasts against the more subdued containers with filled (gray) backgrounds."
    },
    {
      "type": "guideline",
      "content": "States of interactive, emphasized containers.\n\nIf the whole container is interactive, hover is shown through a slightly more prominent drop shadow . When dragged, a much more prominent shadow is shown in order to bring focus to the dragged item and show elevation above the rest of the UI. Note that specific components might have different options and states. Emphasized, default Emphasized, hover Dragged"
    },
    {
      "type": "guideline",
      "content": "A consistent app frame helps create a sense of brand unity and helps users feel comfortable and familiar with our products. Predictable navigation is also especially helpful for users who work across multiple applications, and it makes it easier to learn how to use new products. The Spectrum 2 app frame framework provides a consistent visual style and navigation. It offers foundational structures and guidelines that product teams can adapt to their own contexts. View more details about the S2 app frame. The main content area is defined by a unique container style that's used only in the app frame. It has a subtle drop shadow to provide separation from the navigation. View more about using container styles to divide content within content areas. Example of an app frame with a side navigation."
    }
  ],
  "sourceUrl": "https://main--spectrum-hub--adobe.aem.live/foundations/layout-and-structure/containers",
  "lastUpdated": "2026-09-11",
  "status": "published",
  "tags": [
    "containers",
    "cards",
    "select boxes",
    "padding",
    "spacing",
    "background color",
    "emphasis",
    "border",
    "dividers"
  ]
}
