{
  "$schema": "https://opensource.adobe.com/spectrum-design-data/schemas/v0/guideline.schema.json",
  "$id": "https://opensource.adobe.com/spectrum-design-data/guidelines/motion.json",
  "name": "motion",
  "title": "Motion",
  "category": "designing",
  "documentBlocks": [
    {
      "type": "purpose",
      "content": "Spectrum 2 builds on top of the Spectrum 1 motion guidelines for the design system: that motion is always purposeful, intuitive, and seamless. With this update, we also use motion to draw attention to areas where we want to add personality. No matter what, the usage of motion should be adding meaning to an experience. And, motion over large surface areas needs to support browser and system settings for reduced motion. Motion is also an important part of brand expression. Just like tone in language, tone in motion can range from formal and direct to lighthearted and subtle. Motion in Spectrum 2 is categorized into the areas of directional motion, interaction motion, and wayfinding motion. Wayfinding motion is still in development."
    },
    {
      "type": "guideline",
      "content": "Linear motion indicates forward movement and a sentiment of progress. When emphasizing movement to a different section, page, or item (such as a button or link), the destination is readily clear and minimally disruptive. If you’re creating a custom animation, consider RTL (right-to-left) languages and also how the meaning of motion might differ depending on cultural context. Progress bars communicate forward progression. They work well to show determinate (finite) progress.Image: A labeled progress bar reading \"Progress bar label,\" approximately 60% filled in blue with the remaining portion shown in gray. (source: https://spectrum.adobe.com/foundations/behavior/media_1410ad434da4df2e5f27e65cb39cf6e9dd762b988.png?width=750&format=png&optimize=medium)Image: A labeled progress bar reading \"Progress bar label,\" fully filled in blue from end to end, indicating 100% completion. (source: https://spectrum.adobe.com/foundations/behavior/media_1976d0b4d46d779f561e43f584769fcdb1ee46257.png?width=750&format=png&optimize=medium)In this example of a button, a static arrow icon facing toward the right already indicates forward movement. When linear motion is added to the arrow upon hover, the movement is emphasized. Use this button option with motion sparingly, only on the most important action(s) on a page.Image: A black pill-shaped 'Next' button with a right arrow icon, shown with a cursor positioned just below it, before hover. (source: https://spectrum.adobe.com/foundations/behavior/media_13c1db2becccdae3e3c51faee90f9f0f7223a79ee.png?width=750&format=png&optimize=medium)Image: The same black 'Next' button, now with the cursor positioned directly on top of it in a hover or click state. (source: https://spectrum.adobe.com/foundations/behavior/media_13780e91120d63ef14c91f7ca97c5e88d49481814.png?width=750&format=png&optimize=medium)"
    },
    {
      "type": "guideline",
      "content": "Diagonal motion indicates larger movement, and can be potentially disruptive. This type of motion can be used to emphasize that there’s a switch in context happening, like linking out to a different view or destination. In this example of a link, a static arrow icon facing the top right already indicates a potentially disruptive action. When diagonal motion is added to the arrow on hover, the meaning of the arrow is emphasized. Use this link option with motion sparingly, and only to communicate that there will be a switch in context.Image: Text reading 'For more information, visit the Adobe Help Center' with the link underlined in blue and a diagonal external-link arrow, cursor positioned below the link, before hover. (source: https://spectrum.adobe.com/foundations/behavior/media_16efc4fe0b70604bccaff2a9935bfcd487b64a73e.png?width=750&format=png&optimize=medium)Image: The same 'Adobe Help Center' link, now with the cursor positioned directly on the link text in a hover state. (source: https://spectrum.adobe.com/foundations/behavior/media_1824800b0d2b9ce2e5980fe39e3d526807ab0b7a5.png?width=750&format=png&optimize=medium)"
    },
    {
      "type": "guideline",
      "content": "Clockwise motion indicates a holding pattern that’s repetitive and doesn’t have clear forward momentum or progress. This is most often used for loading indicators. Progress circles have clockwise motion and work well to show indeterminate (infinite) progress.Image: A circular progress indicator on a light gray background, showing roughly 20% complete in blue against a gray track. (source: https://spectrum.adobe.com/foundations/behavior/media_1113e169705ecbd524e5b138be65b9a4e595aaf6f.png?width=750&format=png&optimize=medium)Image: A circular progress indicator on a light gray background, showing roughly 85% complete in blue against a gray track. (source: https://spectrum.adobe.com/foundations/behavior/media_1aa94bf6842145f9e11edf213d92ede35aeab5324.png?width=750&format=png&optimize=medium)"
    },
    {
      "type": "guideline",
      "content": "Motion shows users feedback that, when interacting with the UI, their actions are registering with a system. It’s not the only way to show feedback, but it helps objects to feel more dynamic and responsive. It also can help communicate meaning, or add emphasis that something is happening that requires attention. A microinteraction is a single action (like a click, tap, or swipe) which triggers a response (like a transition or animation). In Spectrum 2, microinteractions offer moments of personality that are reflective of product branding. In this example, the button scales down on the down state, emphasizing that something — the action of selecting — happened. Image: A black pill-shaped button labeled 'Button,' with a cursor positioned below it, before interaction. (source: https://spectrum.adobe.com/foundations/behavior/media_1912db9847e2a13fa026399336088aadc29ab9886.png?width=750&format=png&optimize=medium)Image: The same 'Button' element, slightly larger and darker with a pointer/hand cursor overlapping its bottom edge, indicating a pressed or clicked state. (source: https://spectrum.adobe.com/foundations/behavior/media_16bedff0632adae2a74753d9064814716b15c1265.png?width=750&format=png&optimize=medium)"
    }
  ],
  "sourceUrl": "https://spectrum.adobe.com/foundations/behavior/motion",
  "lastUpdated": "2026-09-04",
  "status": "published",
  "tags": [
    "Motion",
    "Directional motion",
    "Linear motion",
    "Diagonal motion",
    "Clockwise motion",
    "Interaction motion",
    "Wayfinding motion",
    "Microinteractions"
  ]
}
