{
  "$schema": "https://opensource.adobe.com/spectrum-design-data/schemas/v0/guideline.schema.json",
  "$id": "https://opensource.adobe.com/spectrum-design-data/guidelines/drop-shadow.json",
  "name": "drop-shadow",
  "title": "Drop shadow",
  "category": "designing",
  "documentBlocks": [
    { "type": "purpose", "content": "Drop shadow" },
    {
      "type": "guideline",
      "content": "Image: An orange rounded diamond outline with a faint reflection beneath it, illustrating how drop shadow creates a sense of elevation above the surface. (source: https://spectrum.adobe.com/foundations/styles/object-styles/media_1fd2551bf64f7d1ba1e4a78bccbfab61dfe691906.png?width=750&format=png&optimize=medium) Image: A 2x2 grid of rounded square icons where the bottom-left square is highlighted with a purple gradient and stronger shadow, illustrating how drop shadow supports visual emphasis. (source: https://spectrum.adobe.com/foundations/styles/object-styles/media_15bd648d872cc9d7f466b226213858ea74155a8e0.png?width=750&format=png&optimize=medium)"
    },
    {
      "type": "guideline",
      "content": "Create elevation.\n\nUse drop shadows to indicate when content appears above other content. Shadows help establish spatial relationships between interface elements and reinforce the visual hierarchy of the interface."
    },
    {
      "type": "guideline",
      "content": "Support emphasis.\n\nDrop shadows can also be used to emphasize important interface elements. When applied sparingly, they help guide attention while maintaining a clear and consistent visual hierarchy."
    },
    {
      "type": "guideline",
      "content": "Drop shadows are most commonly used when content appears above other content, such as popovers and floating panels. They can also emphasize important interface elements, helping maintain a clear visual hierarchy and consistent sense of depth. Each shadow style is intended for a specific visual purpose. Image: Four rounded white squares numbered 1 through 4 with progressively larger and softer drop shadows, illustrating a scale of shadow depth values. (source: https://spectrum.adobe.com/foundations/styles/object-styles/media_1eb322c7f4517cac9f255fac8142ee3406aaa4637.png?width=750&format=png&optimize=medium) Emphasized, default In certain situations, drop shadows can also be used to provide emphasis to containers within a page. When used appropriately, content that requires more attention will visually stand out, as if it’s slightly elevated or above other content. Emphasized, hover If a whole container is interactive, such as in a select box, the drop shadow becomes emphasized-hover on hover. Elevated Containers that appear on top of content, such as menus and tooltips, have drop shadows to show elevation. Dragged Containers don't use drop shadows by default. When a container is dragged, a drop shadow is applied to indicate that it has been lifted above the interface. This behavior applies to both default and emphasized containers."
    },
    { "type": "guideline", "content": "Drop shadow details" },
    {
      "type": "guideline",
      "content": "Image: A stack of three rounded diamond shapes labeled 1, 2, and 3, illustrating the layered composition of a drop shadow effect. (source: https://spectrum.adobe.com/foundations/styles/object-styles/media_1e55ad9fc6b8cfceff097a32b46183149d33d9353.png?width=750&format=png&optimize=medium)"
    },
    {
      "type": "guideline",
      "content": "Composition.\n\nSpectrum drop shadows are composed of three layers that work together to create a natural sense of depth while preserving the shape of the component. Key shadow Defines the edge of the component against the background. Transition shadow Softens the transition between the key and ambient shadows to create a smoother appearance. Ambient shadow Creates the overall sense of depth and determines the total size of the shadow."
    },
    {
      "type": "guideline",
      "content": "Image: A dark-theme context menu titled \"Publish and export\" with options for Quick export, Open a copy, and Share link, showing a submenu with Illustrator for iPad and Illustrator desktop, each panel using shadow to convey layering. (source: https://spectrum.adobe.com/foundations/styles/object-styles/media_1a3fef3a1425a17547ec0a976a66ac1b4fbf475bd.png?width=750&format=png&optimize=medium)"
    },
    {
      "type": "guideline",
      "content": "Dark theme.\n\nDrop shadows continue to communicate elevation in dark theme, but their appearance is adjusted to maintain sufficient contrast against darker surfaces. Dark theme shadows use three times the opacity of their light theme equivalents. Components that appear above other content, such as popovers, also use a border in dark theme to provide additional separation from the background."
    },
    {
      "type": "guideline",
      "content": "Image: A card UI with an image header and placeholder text lines, shown with a drop shadow against a gray background to illustrate shadow overlay on a light surface. (source: https://spectrum.adobe.com/foundations/styles/object-styles/media_16e79c0908d8d8b02aeb26adfa231019beaac6661.png?width=750&format=png&optimize=medium)"
    },
    {
      "type": "guideline",
      "content": "Overlay.\n\nAn overlay communicates elevation by visually separating foreground content from the rest of the interface. When an overlay is used, such as behind a dialog, an additional drop shadow isn't needed because the overlay already establishes the elevated relationship."
    },
    {
      "type": "guideline",
      "content": "Platform availability.\n\nThese tokens are currently available on web. Guidance for additional platforms will be added in a future release."
    },
    {
      "type": "guideline",
      "content": "Shadow styles.\n\nEach shadow style is represented by a single composite token that defines the key, transition, and ambient shadow layers used to create the final drop shadow. The table below lists the values for each shadow layer: X: Horizontal offset. 0 px for all layers. Y: Vertical offset. The ambient shadow uses the largest offset. Blur: Blur radius. Each layer uses a different value to create a smooth transition between the shadow layers. Spread: Spread value. 0 px for all layers. Shadow style Token Key values Transition values Ambient values Emphasized, default drop-shadow-emphasized X = 0 Y = 0 Blur = 1 Spread = 0 X = 0 Y = 1 Blur = 4 Spread = 0 X = 0 Y = 2 Blur = 8 Spread = 0 Emphasized, hover drop-shadow-emphasized-hover X = 0 Y = 0 Blur = 2 Spread = 0 X = 0 Y = 2 Blur = 6 Spread = 0 X = 0 Y = 4 Blur = 12 Spread = 0 Elevated drop-shadow-elevated X = 0 Y = 0 Blur = 2 Spread = 0 X = 0 Y = 2 Blur = 6 Spread = 0 X = 0 Y = 4 Blur = 12 Spread = 0 Dragged drop-shadow-dragged X = 0 Y = 0 Blur = 6 Spread = 0 X = 0 Y = 6 Blur = 8 Spread = 0 X = 0 Y = 12 Blur = 16 Spread = 0"
    },
    {
      "type": "guideline",
      "content": "Shadow colors.\n\nSpectrum drop shadows use black (#000000) as their base color. The perceived appearance of each shadow is created by varying its opacity and layering. In dark theme, the opacity value is 3× the opacity value of light theme. Shadow color Token Opacity values Emphasized (Key shadow) drop-shadow-emphasized-key-color 8% (light) 24% (dark) Emphasized, hover (Key shadow) drop-shadow-emphasized-hover-key-color 12% (light) 36% (dark) Elevated (Key shadow) drop-shadow-elevated-key-color 12% (light) 36% (dark) Dragged (Key shadow) drop-shadow-dragged-key-color 16% (light) 48% (dark) All styles (Ambient shadow) drop-shadow-ambient-color 8% (light) 24% (dark) All styles (Transition shadow) drop-shadow-transition-color 4% (light) 12% (dark)"
    }
  ],
  "sourceUrl": "https://spectrum.adobe.com/foundations/styles/object-styles/drop-shadow",
  "lastUpdated": "2026-08-14",
  "status": "published",
  "tags": [
    "drop shadow",
    "elevation",
    "ambient shadow",
    "transition shadow",
    "key shadow",
    "dark theme",
    "overlay",
    "shadow tokens"
  ]
}
