{
  "$schema": "https://opensource.adobe.com/spectrum-design-data/schemas/v0/guideline.schema.json",
  "$id": "https://opensource.adobe.com/spectrum-design-data/guidelines/typography-overview.json",
  "name": "typography-overview",
  "title": "Typography",
  "category": "designing",
  "documentBlocks": [
    { "type": "purpose", "content": "Typography" },
    {
      "type": "guideline",
      "content": "Adobe Clean Spectrum is the default font family for Spectrum. It’s based on Adobe Clean, Adobe’s corporate typeface. The Adobe Clean font family includes over 10 typefaces for specific use cases, such as longer reading experiences, displaying code, and supporting a wide range of languages and writing systems. View all Spectrum fonts on the Fonts page. Adobe Clean Spectrum VF is the default typeface for Spectrum on web, iOS, Android, and other supported platforms. It’s a variable font, which means a single font file can support a range of weights and widths."
    },
    {
      "type": "guideline",
      "content": "Adobe Clean Spectrum is the default font family for Spectrum. It’s based on Adobe Clean, Adobe’s corporate typeface. The Adobe Clean font family includes over 10 typefaces for specific use cases, such as longer reading experiences, displaying code, and supporting a wide range of languages and writing systems. Adobe Clean Spectrum VF is the default typeface for Spectrum on web, iOS, Android, and other supported platforms. It’s a variable font, which means a single font file can support a range of weights and widths. Image: \"Adobe Clean Spectrum VF\" headline shown with style tabs (Default, Italic, Condensed, Origin) and a list of available weights from Light to Black. (source: https://spectrum.adobe.com/foundations/typography/media_1c6efb5d6281ac24cdedf4ce5edd22ad459eb7192.png?width=750&format=png&optimize=medium)Image: \"Crafted for Clarity\" headline above a diagram comparing an upright \"A\" and an italic \"a\" with a 12-degree slant angle indicated. (source: https://spectrum.adobe.com/foundations/typography/media_1012f71e83acb02b7d7c110acece752bc814876bc.png?width=750&format=png&optimize=medium)Image: Typeface specs showing \"24 styles\" with 804 glyphs each, and available formats listed as OTF/TTF. (source: https://spectrum.adobe.com/foundations/typography/media_10d0336241a6832acab947c3064d8b0d17a4bb143.png?width=750&format=png&optimize=medium)Image: List of supported scripts: Latin, Cyrillic, CJK, Greek, Thai, Arabic, Hebrew, and Devanagari. (source: https://spectrum.adobe.com/foundations/typography/media_173290f80e14bbcd13a7a945b5bd8e258fe041266.png?width=750&format=png&optimize=medium)"
    },
    {
      "type": "guideline",
      "content": "Image: Adobe Clean typeface displaying a diacritics set, showing the Polish pangram \"Zażółć gęślą jaźń\" with accented characters. (source: https://spectrum.adobe.com/foundations/typography/media_12e7eb93d7d420154635041f22802af852db129bd.png?width=750&format=png&optimize=medium)Image: Adobe Clean typeface displaying standard ligatures, showing the \"ff\" and \"ft\" letter combinations. (source: https://spectrum.adobe.com/foundations/typography/media_1ab4426a25f6472a0751d5c446d2c1261c576a14c.png?width=750&format=png&optimize=medium)Image: Adobe Clean typeface displaying tabular figures, showing the numerals 0 through 5 in bold weight. (source: https://spectrum.adobe.com/foundations/typography/media_1dda11559e4a0d3cb6dcdef680372b595b81171d1.png?width=750&format=png&optimize=medium)"
    },
    {
      "type": "guideline",
      "content": "Adobe Clean Spectrum VF provides two main benefits over the non-variable versions: Improves alignment with UI elements. Adobe Clean Spectrum VF uses updated baseline metrics, which are the measurements that determine how text is positioned. These updated metrics help text align more consistently with other interface elements, such as icons, components, and avatars. Supports future adjustments. Spectrum currently recommends using the default weights and widths. However, the variable font makes it easier to fine-tune typography in future updates. For example, a slightly thinner weight may improve readability in dark mode. Learn more about Adobe Clean Spectrum VF in the Spectrum 2 typography guide."
    },
    {
      "type": "guideline",
      "content": "Jump to.\n\nImage: Icon illustrating \"Typography system,\" showing two \"T\" letterforms in a blue-to-green gradient above a font-size adjustment icon. (source: https://spectrum.adobe.com/foundations/typography/media_1735d74eaa72d8a5b4d22dfa24c63543afc0266e5.png?width=750&format=png&optimize=medium) Typography system Typography system Image: Icon illustrating \"Applying the type system,\" showing two overlapping \"T\" letterforms in a blue-to-teal gradient. (source: https://spectrum.adobe.com/foundations/typography/media_1bfdcea0ca1f5a86d02adde5500e376465c822b02.png?width=750&format=png&optimize=medium) Applying the type system Applying the type system Image: Icon illustrating \"Fonts,\" showing a stylized italic lowercase \"f\" in a pink gradient. (source: https://spectrum.adobe.com/foundations/typography/media_1d2071b303ba5882b375bbdf5257b1d939c891101.png?width=750&format=png&optimize=medium) Fonts Fonts"
    }
  ],
  "sourceUrl": "https://spectrum.adobe.com/foundations/typography/overview",
  "lastUpdated": "2026-08-13",
  "status": "published",
  "tags": [
    "Typography",
    "Adobe Clean Spectrum",
    "Spectrum VF",
    "variable font",
    "baseline metrics",
    "UI alignment",
    "font family",
    "readability"
  ]
}
