{
  "$schema": "https://opensource.adobe.com/spectrum-design-data/schemas/v0/guideline.schema.json",
  "$id": "https://opensource.adobe.com/spectrum-design-data/guidelines/bi-directionality.json",
  "name": "bi-directionality",
  "title": "Bi-directionality",
  "category": "designing",
  "documentBlocks": [
    { "type": "purpose", "content": "Bi-directionality" },
    {
      "type": "guideline",
      "content": "In digital experiences, languages that are based on Latin script (e.g., English and French), Cyrillic script (e.g., Russian and Bulgarian), Chinese and Japanese* are consistently read and written from left to right. Languages that are based on certain writing systems like Arabic (e.g., Arabic, Persian, and Urdu) and Hebrew (Hebrew and Yiddish), are mostly read and written from right to left. These languages are called “bi-directional,” or are also commonly referred to as “RTL” (“right-to-left”) languages. Digital experiences for these languages should be mirrored to follow the same right-to-left reading pattern. UI mirroring is the process of positioning components in the opposite side of the interface, which creates, as the term suggests, a mirror-like effect. *Chinese and Japanese, especially in printing, books, and publications, maintain their top-to-bottom, right-to-left writing/reading patterns, but are mainly using the left-to-right system in digital experiences."
    },
    {
      "type": "guideline",
      "content": "Mirror individual components.\n\nComponents and their constituting parts are affected by user interface mirroring. Mirroring guidelines for each component are available on their respective pages, when applicable. Image: Key example showing the correct usage of a bi-directional component. (source: https://spectrum.adobe.com/foundations/inclusivity/media_18e5aff774a8531f0cf4fb9dc3f5a154b7f6ef74a.png?width=750&format=png&optimize=medium)"
    },
    {
      "type": "guideline",
      "content": "Don't mirror components that represent time.\n\nComponents that are used to represent the concept of time should not be mirrored (e.g., a video player). Image: Key example showing the incorrect usage of a bi-directional component. (source: https://spectrum.adobe.com/foundations/inclusivity/media_19187d9d281d10a389dfd6809de49d18be985e1fe.png?width=750&format=png&optimize=medium)"
    },
    {
      "type": "guideline",
      "content": "Mirror composite images with directional flow.\n\nComposite images that depict a directional flow or convey a linear narrative require a dedicated bi-directional version since the sense of the narrative, reading from right to left, could appear reversed. Image: Key example of correct usage of bi-directional flow in a linear narrative. (source: https://spectrum.adobe.com/foundations/inclusivity/media_1a664a66a07b819bd3aff649b113040ff5097d898.png?width=750&format=png&optimize=medium)"
    },
    {
      "type": "guideline",
      "content": "Mirror icons that represent movement.\n\nIcons that depict horizontal movement (e.g., back icon) should be mirrored to follow the flow of the right-to-left interface. Image: Key examples of mirror icons that represent movement. (source: https://spectrum.adobe.com/foundations/inclusivity/media_195d5a351b079313e2e11c0dae134d74588e500f7.png?width=750&format=png&optimize=medium)"
    },
    {
      "type": "guideline",
      "content": "Don't mirror icons that represent time.\n\nIcons that refer to the passage of time (e.g., clock icon) should not be mirrored in right-to-left interfaces. Image: Key example of incorrectly mirroring icons that represent time. (source: https://spectrum.adobe.com/foundations/inclusivity/media_1b374016f329125585285f97e193eebd2acbc4e4a.png?width=750&format=png&optimize=medium)"
    },
    {
      "type": "guideline",
      "content": "Don't mirror checkmarks.\n\nCheckmarks are never mirrored in right-to-left interfaces. Image: Key example of illustrating not to mirror the checkmark component. (source: https://spectrum.adobe.com/foundations/inclusivity/media_1f3f57010df37d6833fadad8b45af031d78e543a8.png?width=750&format=png&optimize=medium)"
    },
    {
      "type": "guideline",
      "content": "Don't mirror slashes.\n\nSlashes are never mirrored in right-to-left interfaces. Image: Key example illustrating not to mirror slash marks. (source: https://spectrum.adobe.com/foundations/inclusivity/media_1eaa9deb489f9741568d5c8549da5fbb7742191c4.png?width=750&format=png&optimize=medium)"
    }
  ],
  "sourceUrl": "https://spectrum.adobe.com/foundations/inclusivity/bi-directionality",
  "lastUpdated": "2026-09-03",
  "status": "published",
  "tags": [
    "bi-directional",
    "RTL",
    "UI mirroring",
    "right-to-left",
    "time icons",
    "back icon",
    "checkmarks",
    "slashes",
    "directional flow",
    "iconography mirroring"
  ]
}
